(gdb) bt
#0  ehci_irq (hcd=0xffffffc0e7eca800) at drivers/usb/host/ehci-hcd.c:713
#1  0xffffff8008851bdc in usb_hcd_irq (irq=<optimized out>, __hcd=0xffffffc0e7eca800) at drivers/usb/core/hcd.c:2538
#2  0xffffff80081130a4 in __handle_irq_event_percpu (desc=0xffffffc0e9b82a00, flags=0xffffff8008003ee4)
    at kernel/irq/handle.c:149
#3  0xffffff8008113238 in handle_irq_event_percpu (desc=0xffffffc0e9b82a00) at kernel/irq/handle.c:189
#4  0xffffff80081132dc in handle_irq_event (desc=0xffffffc0e9b82a00) at kernel/irq/handle.c:206
#5  0xffffff8008117d6c in handle_fasteoi_irq (desc=0xffffffc0e9b82a00) at kernel/irq/chip.c:743
#6  0xffffff80081120e4 in generic_handle_irq_desc (desc=<optimized out>) at ./include/linux/irqdesc.h:155
#7  generic_handle_irq (irq=14) at kernel/irq/irqdesc.c:639
#8  0xffffff800811287c in __handle_domain_irq (domain=0xffffffc00020a200, hwirq=<optimized out>, lookup=true,
    regs=0xffffff8009453cf0) at kernel/irq/irqdesc.c:676
#9  0xffffff8008081174 in handle_domain_irq (regs=<optimized out>, hwirq=<optimized out>, domain=<optimized out>)
    at ./include/linux/irqdesc.h:173
#10 gic_handle_irq (regs=0xffffff8009453cf0) at drivers/irqchip/irq-gic-v3.c:373
#11 0xffffff8008082bf0 in el1_irq () at arch/arm64/kernel/entry.S:645
Backtrace stopped: previous frame identical to this frame (corrupt stack?)


[ 2134.278291] sysrq: DEBUG
[ 2965.407983] usb 2-1: new high-speed USB device number 2 using ehci-platform
[ 2972.748874] rk3x-i2c fdd40000.i2c: timeout, ipd: 0x23, state: 3
[ 2972.904329] usb 2-1: New USB device found, idVendor=3535, idProduct=6300, bcdDevice= 1.10
[ 2972.904436] usb 2-1: New USB device strings: Mfr=1, Product=2, SerialNumber=3
[ 2972.904469] usb 2-1: Product: U330
[ 2972.904497] usb 2-1: Manufacturer: aigo
[ 2972.904626] usb 2-1: SerialNumber: 9000586511335F31
[ 2972.907442] usb-storage 2-1:1.0: USB Mass Storage device detected
[ 2972.909167] ======== CAMERA DMA ALLOC SUCCESS ========
[ 2972.909193]   devName: fd880000.usb
[ 2972.909198]   bufferSize: 0 MB
[ 2972.909204]   DMA physical address: 0xeec7d000
[ 2972.909210]   kernel virtual address: 00000000d356dd73
[ 2972.909215] ==========================================
[ 2972.909392] scsi host1: usb-storage 2-1:1.0
[ 2973.919815] scsi 1:0:0:0: Direct-Access     aigo     U330             PMAP PQ: 0 ANSI: 6
[ 2973.923516] sd 1:0:0:0: [sda] 122880000 512-byte logical blocks: (62.9 GB/58.6 GiB)
[ 2973.924656] sd 1:0:0:0: [sda] Write Protect is off
[ 2973.924692] sd 1:0:0:0: [sda] Mode Sense: 45 00 00 00
[ 2973.925901] sd 1:0:0:0: [sda] Write cache: disabled, read cache: enabled, doesn't support DPO or FUA
[ 2974.439435]  sda: sda1
[ 2974.445803] sd 1:0:0:0: [sda] Attached SCSI removable disk
[ 2974.667800] FAT-fs (sda1): utf8 is not a recommended IO charset for FAT filesystems, filesystem will be case sensitive!












root@ATK-DLRK3568:/sys/kernel/debug/usb/usbmon# cat /sys/kernel/debug/usb/devices
T:  Bus=01 Lev=00 Prnt=00 Port=00 Cnt=00 Dev#=  1 Spd=480  MxCh= 1
B:  Alloc=  0/800 us ( 0%), #Int=  0, #Iso=  0
D:  Ver= 2.00 Cls=09(hub  ) Sub=00 Prot=00 MxPS=64 #Cfgs=  1
P:  Vendor=1d6b ProdID=0002 Rev= 4.19
S:  Manufacturer=Linux 4.19.232 ehci_hcd
S:  Product=EHCI Host Controller
S:  SerialNumber=fd800000.usb
C:* #Ifs= 1 Cfg#= 1 Atr=e0 MxPwr=  0mA
I:* If#= 0 Alt= 0 #EPs= 1 Cls=09(hub  ) Sub=00 Prot=00 Driver=hub
E:  Ad=81(I) Atr=03(Int.) MxPS=   4 Ivl=256ms

T:  Bus=02 Lev=00 Prnt=00 Port=00 Cnt=00 Dev#=  1 Spd=480  MxCh= 1
B:  Alloc=  0/800 us ( 0%), #Int=  0, #Iso=  0
D:  Ver= 2.00 Cls=09(hub  ) Sub=00 Prot=00 MxPS=64 #Cfgs=  1
P:  Vendor=1d6b ProdID=0002 Rev= 4.19
S:  Manufacturer=Linux 4.19.232 ehci_hcd
S:  Product=EHCI Host Controller
S:  SerialNumber=fd880000.usb
C:* #Ifs= 1 Cfg#= 1 Atr=e0 MxPwr=  0mA
I:* If#= 0 Alt= 0 #EPs= 1 Cls=09(hub  ) Sub=00 Prot=00 Driver=hub
E:  Ad=81(I) Atr=03(Int.) MxPS=   4 Ivl=256ms

T:  Bus=03 Lev=00 Prnt=00 Port=00 Cnt=00 Dev#=  1 Spd=12   MxCh= 1
B:  Alloc=  0/900 us ( 0%), #Int=  0, #Iso=  0
D:  Ver= 1.10 Cls=09(hub  ) Sub=00 Prot=00 MxPS=64 #Cfgs=  1
P:  Vendor=1d6b ProdID=0001 Rev= 4.19
S:  Manufacturer=Linux 4.19.232 ohci_hcd
S:  Product=Generic Platform OHCI controller
S:  SerialNumber=fd840000.usb
C:* #Ifs= 1 Cfg#= 1 Atr=e0 MxPwr=  0mA
I:* If#= 0 Alt= 0 #EPs= 1 Cls=09(hub  ) Sub=00 Prot=00 Driver=hub
E:  Ad=81(I) Atr=03(Int.) MxPS=   2 Ivl=255ms

T:  Bus=04 Lev=00 Prnt=00 Port=00 Cnt=00 Dev#=  1 Spd=12   MxCh= 1
B:  Alloc= 14/900 us ( 2%), #Int=  1, #Iso=  0
D:  Ver= 1.10 Cls=09(hub  ) Sub=00 Prot=00 MxPS=64 #Cfgs=  1
P:  Vendor=1d6b ProdID=0001 Rev= 4.19
S:  Manufacturer=Linux 4.19.232 ohci_hcd
S:  Product=Generic Platform OHCI controller
S:  SerialNumber=fd8c0000.usb
C:* #Ifs= 1 Cfg#= 1 Atr=e0 MxPwr=  0mA
I:* If#= 0 Alt= 0 #EPs= 1 Cls=09(hub  ) Sub=00 Prot=00 Driver=hub
E:  Ad=81(I) Atr=03(Int.) MxPS=   2 Ivl=255ms

T:  Bus=04 Lev=01 Prnt=01 Port=00 Cnt=01 Dev#=  2 Spd=1.5  MxCh= 0               //////// Lev=01
D:  Ver= 2.00 Cls=00(>ifc ) Sub=00 Prot=00 MxPS= 8 #Cfgs=  1
P:  Vendor=17ef ProdID=6050 Rev= 0.09
S:  Product=Lenovo Precision USB Mouse
C:* #Ifs= 1 Cfg#= 1 Atr=a0 MxPwr=100mA
I:* If#= 0 Alt= 0 #EPs= 1 Cls=03(HID  ) Sub=01 Prot=02 Driver=usbhid
E:  Ad=81(I) Atr=03(Int.) MxPS=   8 Ivl=10ms

T:  Bus=05 Lev=00 Prnt=00 Port=00 Cnt=00 Dev#=  1 Spd=480  MxCh= 1
B:  Alloc=  0/800 us ( 0%), #Int=  0, #Iso=  0
D:  Ver= 2.00 Cls=09(hub  ) Sub=00 Prot=01 MxPS=64 #Cfgs=  1
P:  Vendor=1d6b ProdID=0002 Rev= 4.19
S:  Manufacturer=Linux 4.19.232 xhci-hcd
S:  Product=xHCI Host Controller
S:  SerialNumber=xhci-hcd.0.auto
C:* #Ifs= 1 Cfg#= 1 Atr=e0 MxPwr=  0mA
I:* If#= 0 Alt= 0 #EPs= 1 Cls=09(hub  ) Sub=00 Prot=00 Driver=hub
E:  Ad=81(I) Atr=03(Int.) MxPS=   4 Ivl=256ms

T:  Bus=06 Lev=00 Prnt=00 Port=00 Cnt=00 Dev#=  1 Spd=5000 MxCh= 1
B:  Alloc=  0/800 us ( 0%), #Int=  0, #Iso=  0
D:  Ver= 3.00 Cls=09(hub  ) Sub=00 Prot=03 MxPS= 9 #Cfgs=  1
P:  Vendor=1d6b ProdID=0003 Rev= 4.19
S:  Manufacturer=Linux 4.19.232 xhci-hcd
S:  Product=xHCI Host Controller




//
ffffffc0e5821300 4013943859 C Ii:4:002:1 0:8 5 = 10000000 00
ffffffc0e5821300 4013944056 S Ii:4:002:1 -115:8 5 <
ffffffc0e5821300 4013991837 C Ii:4:002:1 0:8 5 = 14000000 00
ffffffc0e5821300 4013991904 S Ii:4:002:1 -115:8 5 <
ffffffc0e5821300 4014095835 C Ii:4:002:1 0:8 5 = 00000000 00
ffffffc0e5821300 4014095897 S Ii:4:002:1 -115:8 5 <
ffffffc0e5821300 4014983934 C Ii:4:002:1 0:8 5 = 00feffff 00
ffffffc0e5821300 4014984117 S Ii:4:002:1 -115:8 5 <
ffffffc0e5821300 4014991839 C Ii:4:002:1 0:8 5 = 00fcefff 00
ffffffc0e5821300 4014991904 S Ii:4:002:1 -115:8 5 <
ffffffc0e5821300 4014999840 C Ii:4:002:1 0:8 5 = 00ff0f00 00
ffffffc0e5821300 4014999903 S Ii:4:002:1 -115:8 5 <
ffffffc0e5821300 4015007836 C Ii:4:002:1 0:8 5 = 00feffff 00
ffffffc0e5821300 4015007894 S Ii:4:002:1 -115:8 5 <
ffffffc0e5821300 4015015870 C Ii:4:002:1 0:8 5 = 00feffff 00
ffffffc0e5821300 4015015937 S Ii:4:002:1 -115:8 5 <
ffffffc0e5821300 4015023869 C Ii:4:002:1 0:8 5 = 00ff0f00 00
ffffffc0e5821300 4015023939 S Ii:4:002:1 -115:8 5 <
ffffffc0e5821300 4015263838 C Ii:4:002:1 0:8 5 = 00ffffff 00
ffffffc0e5821300 4015263898 S Ii:4:002:1 -115:8 5 <
^C
root@ATK-DLRK3568:/sys/kernel/debug/usb/usbmon# cat 4u   ///  Bus=04 Lev=01 Prnt=01 Port=00 Cnt=01 Dev#=  2 

S:  SerialNumber=xhci-hcd.0.auto
C:* #Ifs= 1 Cfg#= 1 Atr=e0 MxPwr=  0mA
I:* If#= 0 Alt= 0 #EPs= 1 Cls=09(hub  ) Sub=00 Prot=00 Driver=hub
E:  Ad=81(I) Atr=03(Int.) MxPS=   4 Ivl=256ms

